{
  "schemaVersion": 2,
  "generatorVersion": "character-animation-profile-builder/2.0.0",
  "sourceDigest": "sha256:589375dbeb75bf3ed49f14095ac59c05c613012162bd36c924825e927574242c",
  "changeLog": "Episode1 exact2 COMPLETE48 chain dragger raider atomic animation profile",
  "contentContractReceipt": "sha256:0d1863db84c211254d0236fad1fe035624998ac448423f4ba82f191cb3257da3",
  "productionGovernanceReceipt": "sha256:156bed56f5247b93d3f315463651f223cd044fca879f543336c83b39c7c23864",
  "characterId": "character.chain_dragger_raider.1",
  "attackDisabledCcReachable": true,
  "states": [
    { "animationId":"animation.character.chain_dragger_raider.1.idle.v2", "slot":"Idle", "loop":true, "mirrorLeftFromRight":true, "rootMotion":false, "clips":[{"direction":"IdleUpRight","clipPath":"Assets/AnimationClips/Character/character.chain_dragger_raider.1/character.chain_dragger_raider.1.idle.v2.Right.anim"},{"direction":"IdleUpLeft","clipPath":"Assets/AnimationClips/Character/character.chain_dragger_raider.1/character.chain_dragger_raider.1.idle.v2.Left.anim"},{"direction":"IdleDownRight","clipPath":"Assets/AnimationClips/Character/character.chain_dragger_raider.1/character.chain_dragger_raider.1.idle.v2.Right.anim"},{"direction":"IdleDownLeft","clipPath":"Assets/AnimationClips/Character/character.chain_dragger_raider.1/character.chain_dragger_raider.1.idle.v2.Left.anim"}]},
    { "animationId":"animation.character.chain_dragger_raider.1.move.v2", "slot":"Move", "loop":true, "mirrorLeftFromRight":true, "rootMotion":false, "clips":[{"direction":"MoveUpRight","clipPath":"Assets/AnimationClips/Character/character.chain_dragger_raider.1/character.chain_dragger_raider.1.move.v2.Right.anim"},{"direction":"MoveUpLeft","clipPath":"Assets/AnimationClips/Character/character.chain_dragger_raider.1/character.chain_dragger_raider.1.move.v2.Left.anim"},{"direction":"MoveDownRight","clipPath":"Assets/AnimationClips/Character/character.chain_dragger_raider.1/character.chain_dragger_raider.1.move.v2.Right.anim"},{"direction":"MoveDownLeft","clipPath":"Assets/AnimationClips/Character/character.chain_dragger_raider.1/character.chain_dragger_raider.1.move.v2.Left.anim"}]},
    { "animationId":"animation.character.chain_dragger_raider.1.basic_attack.chain_swing.v2", "slot":"BasicAttack", "loop":false, "mirrorLeftFromRight":true, "rootMotion":false, "clips":[{"direction":"AttackUpRight","clipPath":"Assets/AnimationClips/Character/character.chain_dragger_raider.1/character.chain_dragger_raider.1.basic_attack.v2.Right.anim"},{"direction":"AttackUpLeft","clipPath":"Assets/AnimationClips/Character/character.chain_dragger_raider.1/character.chain_dragger_raider.1.basic_attack.v2.Left.anim"},{"direction":"AttackDownRight","clipPath":"Assets/AnimationClips/Character/character.chain_dragger_raider.1/character.chain_dragger_raider.1.basic_attack.v2.Right.anim"},{"direction":"AttackDownLeft","clipPath":"Assets/AnimationClips/Character/character.chain_dragger_raider.1/character.chain_dragger_raider.1.basic_attack.v2.Left.anim"}]},
    { "animationId":"animation.character.chain_dragger_raider.1.death.v2", "slot":"Death", "loop":false, "mirrorLeftFromRight":true, "rootMotion":false, "clips":[{"direction":"DeathUpRight","clipPath":"Assets/AnimationClips/Character/character.chain_dragger_raider.1/character.chain_dragger_raider.1.death.v2.anim"},{"direction":"DeathUpLeft","clipPath":"Assets/AnimationClips/Character/character.chain_dragger_raider.1/character.chain_dragger_raider.1.death.v2.anim"},{"direction":"DeathDownRight","clipPath":"Assets/AnimationClips/Character/character.chain_dragger_raider.1/character.chain_dragger_raider.1.death.v2.anim"},{"direction":"DeathDownLeft","clipPath":"Assets/AnimationClips/Character/character.chain_dragger_raider.1/character.chain_dragger_raider.1.death.v2.anim"}]},
    { "animationId":"animation.character.chain_dragger_raider.1.stun.v2", "slot":"AttackDisabledCc", "loop":true, "mirrorLeftFromRight":true, "rootMotion":false, "clips":[{"direction":"IdleUpRight","clipPath":"Assets/AnimationClips/Character/character.chain_dragger_raider.1/character.chain_dragger_raider.1.stun.v2.anim"},{"direction":"IdleUpLeft","clipPath":"Assets/AnimationClips/Character/character.chain_dragger_raider.1/character.chain_dragger_raider.1.stun.v2.anim"},{"direction":"IdleDownRight","clipPath":"Assets/AnimationClips/Character/character.chain_dragger_raider.1/character.chain_dragger_raider.1.stun.v2.anim"},{"direction":"IdleDownLeft","clipPath":"Assets/AnimationClips/Character/character.chain_dragger_raider.1/character.chain_dragger_raider.1.stun.v2.anim"}]}
  ],
  "skillActions": []
}
